20:34:41.473036 ARP, Request who-has 128.30.4.223 tell 128.30.4.222, length 28
20:34:41.473505 ARP, Reply 128.30.4.223 is-at 00:16:ea:8d:e5:8a (oui Unknown), length 28
20:34:41.473518 IP 128.30.4.222.39675 > 128.30.4.223.5001: Flags [S], seq 1258159963, win 14600, options [mss 1460,sackOK,TS val 282136473 ecr 0,nop,wscale 7], length 0
20:34:41.474055 IP 128.30.4.223.5001 > 128.30.4.222.39675: Flags [S.], seq 2924083256, ack 1258159964, win 14480, options [mss 1460,sackOK,TS val 282202089 ecr 282136473,nop,wscale 7], length 0
20:34:41.474079 IP 128.30.4.222.39675 > 128.30.4.223.5001: Flags [.], ack 1, win 115, options [nop,nop,TS val 282136474 ecr 282202089], length 0
20:34:41.474166 IP 128.30.4.222.39675 > 128.30.4.223.5001: Flags [P.], seq 1:25, ack 1, win 115, options [nop,nop,TS val 282136474 ecr 282202089], length 24
20:34:41.474206 IP 128.30.4.222.39675 > 128.30.4.223.5001: Flags [.], seq 25:1473, ack 1, win 115, options [nop,nop,TS val 282136474 ecr 282202089], length 1448
20:34:41.474225 IP 128.30.4.222.39675 > 128.30.4.223.5001: Flags [.], seq 1473:2921, ack 1, win 115, options [nop,nop,TS val 282136474 ecr 282202089], length 1448
20:34:41.474232 IP 128.30.4.222.39675 > 128.30.4.223.5001: Flags [.], seq 2921:4369, ack 1, win 115, options [nop,nop,TS val 282136474 ecr 282202089], length 1448
20:34:41.474255 IP 128.30.4.222.39675 > 128.30.4.223.5001: Flags [.], seq 4369:5817, ack 1, win 115, options [nop,nop,TS val 282136474 ecr 282202089], length 1448
20:34:41.474263 IP 128.30.4.222.39675 > 128.30.4.223.5001: Flags [.], seq 5817:7265, ack 1, win 115, options [nop,nop,TS val 282136474 ecr 282202089], length 1448
20:34:41.474271 IP 128.30.4.222.39675 > 128.30.4.223.5001: Flags [.], seq 7265:8713, ack 1, win 115, options [nop,nop,TS val 282136474 ecr 282202089], length 1448
20:34:41.474276 IP 128.30.4.222.39675 > 128.30.4.223.5001: Flags [.], seq 8713:10161, ack 1, win 115, options [nop,nop,TS val 282136474 ecr 282202089], length 1448
20:34:41.474282 IP 128.30.4.222.39675 > 128.30.4.223.5001: Flags [.], seq 10161:11609, ack 1, win 115, options [nop,nop,TS val 282136474 ecr 282202089], length 1448
20:34:41.474286 IP 128.30.4.222.39675 > 128.30.4.223.5001: Flags [.], seq 11609:13057, ack 1, win 115, options [nop,nop,TS val 282136474 ecr 282202089], length 1448
20:34:41.474972 IP 128.30.4.223.5001 > 128.30.4.222.39675: Flags [.], ack 25, win 114, options [nop,nop,TS val 282202090 ecr 282136474], length 0
20:34:41.474992 IP 128.30.4.222.39675 > 128.30.4.223.5001: Flags [.], seq 13057:14505, ack 1, win 115, options [nop,nop,TS val 282136474 ecr 282202090], length 1448
20:34:41.477605 IP 128.30.4.223.5001 > 128.30.4.222.39675: Flags [.], ack 1473, win 136, options [nop,nop,TS val 282202092 ecr 282136474], length 0
20:34:41.477623 IP 128.30.4.222.39675 > 128.30.4.223.5001: Flags [P.], seq 14505:15953, ack 1, win 115, options [nop,nop,TS val 282136477 ecr 282202092], length 1448
20:34:41.477637 IP 128.30.4.222.39675 > 128.30.4.223.5001: Flags [.], seq 15953:17401, ack 1, win 115, options [nop,nop,TS val 282136477 ecr 282202092], length 1448
20:34:41.477644 IP 128.30.4.222.39675 > 128.30.4.223.5001: Flags [.], seq 17401:18849, ack 1, win 115, options [nop,nop,TS val 282136477 ecr 282202092], length 1448
20:34:41.482047 IP 128.30.4.223.5001 > 128.30.4.222.39675: Flags [.], ack 2921, win 159, options [nop,nop,TS val 282202095 ecr 282136474], length 0
20:34:41.482059 IP 128.30.4.222.39675 > 128.30.4.223.5001: Flags [.], seq 18849:20297, ack 1, win 115, options [nop,nop,TS val 282136482 ecr 282202095], length 1448
20:34:41.482068 IP 128.30.4.222.39675 > 128.30.4.223.5001: Flags [.], seq 20297:21745, ack 1, win 115, options [nop,nop,TS val 282136482 ecr 282202095], length 1448
20:34:41.482300 IP 128.30.4.223.5001 > 128.30.4.222.39675: Flags [.], ack 4369, win 181, options [nop,nop,TS val 282202097 ecr 282136474], length 0
20:34:41.482309 IP 128.30.4.222.39675 > 128.30.4.223.5001: Flags [.], seq 21745:23193, ack 1, win 115, options [nop,nop,TS val 282136482 ecr 282202097], length 1448
20:34:41.482317 IP 128.30.4.222.39675 > 128.30.4.223.5001: Flags [.], seq 23193:24641, ack 1, win 115, options [nop,nop,TS val 282136482 ecr 282202097], length 1448
20:34:41.487186 IP 128.30.4.223.5001 > 128.30.4.222.39675: Flags [.], ack 5817, win 204, options [nop,nop,TS val 282202101 ecr 282136474], length 0
20:34:41.487200 IP 128.30.4.222.39675 > 128.30.4.223.5001: Flags [.], seq 24641:26089, ack 1, win 115, options [nop,nop,TS val 282136487 ecr 282202101], length 1448
20:34:41.487211 IP 128.30.4.222.39675 > 128.30.4.223.5001: Flags [.], seq 26089:27537, ack 1, win 115, options [nop,nop,TS val 282136487 ecr 282202101], length 1448
20:34:41.487467 IP 128.30.4.223.5001 > 128.30.4.222.39675: Flags [.], ack 7265, win 227, options [nop,nop,TS val 282202102 ecr 282136474], length 0
20:34:41.487486 IP 128.30.4.222.39675 > 128.30.4.223.5001: Flags [.], seq 27537:28985, ack 1, win 115, options [nop,nop,TS val 282136487 ecr 282202102], length 1448
20:34:41.487500 IP 128.30.4.222.39675 > 128.30.4.223.5001: Flags [P.], seq 28985:30433, ack 1, win 115, options [nop,nop,TS val 282136487 ecr 282202102], length 1448
20:34:41.489798 IP 128.30.4.223.5001 > 128.30.4.222.39675: Flags [.], ack 8713, win 249, options [nop,nop,TS val 282202104 ecr 282136474], length 0
20:34:41.489825 IP 128.30.4.222.39675 > 128.30.4.223.5001: Flags [.], seq 30433:31881, ack 1, win 115, options [nop,nop,TS val 282136489 ecr 282202104], length 1448
20:34:41.489852 IP 128.30.4.222.39675 > 128.30.4.223.5001: Flags [P.], seq 31881:32793, ack 1, win 115, options [nop,nop,TS val 282136489 ecr 282202104], length 912
20:34:41.492187 IP 128.30.4.223.5001 > 128.30.4.222.39675: Flags [.], ack 10161, win 272, options [nop,nop,TS val 282202107 ecr 282136474], length 0
20:34:41.492199 IP 128.30.4.222.39675 > 128.30.4.223.5001: Flags [.], seq 32793:34241, ack 1, win 115, options [nop,nop,TS val 282136492 ecr 282202107], length 1448
20:34:41.492210 IP 128.30.4.222.39675 > 128.30.4.223.5001: Flags [.], seq 34241:35689, ack 1, win 115, options [nop,nop,TS val 282136492 ecr 282202107], length 1448
20:34:41.496704 IP 128.30.4.223.5001 > 128.30.4.222.39675: Flags [.], ack 11609, win 295, options [nop,nop,TS val 282202109 ecr 282136474], length 0
20:34:41.496721 IP 128.30.4.222.39675 > 128.30.4.223.5001: Flags [.], seq 35689:37137, ack 1, win 115, options [nop,nop,TS val 282136496 ecr 282202109], length 1448
20:34:41.496733 IP 128.30.4.222.39675 > 128.30.4.223.5001: Flags [.], seq 37137:38585, ack 1, win 115, options [nop,nop,TS val 282136496 ecr 282202109], length 1448
20:34:41.496943 IP 128.30.4.223.5001 > 128.30.4.222.39675: Flags [.], ack 13057, win 317, options [nop,nop,TS val 282202111 ecr 282136474], length 0
20:34:41.496955 IP 128.30.4.222.39675 > 128.30.4.223.5001: Flags [.], seq 38585:40033, ack 1, win 115, options [nop,nop,TS val 282136496 ecr 282202111], length 1448
20:34:41.496963 IP 128.30.4.222.39675 > 128.30.4.223.5001: Flags [.], seq 40033:41481, ack 1, win 115, options [nop,nop,TS val 282136496 ecr 282202111], length 1448
20:34:41.499373 IP 128.30.4.223.5001 > 128.30.4.222.39675: Flags [.], ack 14505, win 331, options [nop,nop,TS val 282202114 ecr 282136474], length 0
20:34:41.499387 IP 128.30.4.222.39675 > 128.30.4.223.5001: Flags [.], seq 41481:42929, ack 1, win 115, options [nop,nop,TS val 282136499 ecr 282202114], length 1448
20:34:41.499397 IP 128.30.4.222.39675 > 128.30.4.223.5001: Flags [.], seq 42929:44377, ack 1, win 115, options [nop,nop,TS val 282136499 ecr 282202114], length 1448
20:34:41.504059 IP 128.30.4.223.5001 > 128.30.4.222.39675: Flags [.], ack 15953, win 331, options [nop,nop,TS val 282202118 ecr 282136477], length 0
20:34:41.504078 IP 128.30.4.222.39675 > 128.30.4.223.5001: Flags [.], seq 44377:45825, ack 1, win 115, options [nop,nop,TS val 282136504 ecr 282202118], length 1448
20:34:41.504091 IP 128.30.4.222.39675 > 128.30.4.223.5001: Flags [.], seq 45825:47273, ack 1, win 115, options [nop,nop,TS val 282136504 ecr 282202118], length 1448
20:34:41.504356 IP 128.30.4.223.5001 > 128.30.4.222.39675: Flags [.], ack 17401, win 331, options [nop,nop,TS val 282202119 ecr 282136477], length 0
20:34:41.504363 IP 128.30.4.222.39675 > 128.30.4.223.5001: Flags [.], seq 47273:48721, ack 1, win 115, options [nop,nop,TS val 282136504 ecr 282202119], length 1448
20:34:41.504369 IP 128.30.4.222.39675 > 128.30.4.223.5001: Flags [.], seq 48721:50169, ack 1, win 115, options [nop,nop,TS val 282136504 ecr 282202119], length 1448
20:34:41.506757 IP 128.30.4.223.5001 > 128.30.4.222.39675: Flags [.], ack 18849, win 331, options [nop,nop,TS val 282202121 ecr 282136477], length 0
20:34:41.506765 IP 128.30.4.222.39675 > 128.30.4.223.5001: Flags [.], seq 50169:51617, ack 1, win 115, options [nop,nop,TS val 282136506 ecr 282202121], length 1448
20:34:41.506772 IP 128.30.4.222.39675 > 128.30.4.223.5001: Flags [.], seq 51617:53065, ack 1, win 115, options [nop,nop,TS val 282136506 ecr 282202121], length 1448
20:34:41.509372 IP 128.30.4.223.5001 > 128.30.4.222.39675: Flags [.], ack 20297, win 331, options [nop,nop,TS val 282202124 ecr 282136482], length 0
20:34:41.509381 IP 128.30.4.222.39675 > 128.30.4.223.5001: Flags [P.], seq 53065:54513, ack 1, win 115, options [nop,nop,TS val 282136509 ecr 282202124], length 1448
20:34:41.509402 IP 128.30.4.222.39675 > 128.30.4.223.5001: Flags [.], seq 54513:55961, ack 1, win 115, options [nop,nop,TS val 282136509 ecr 282202124], length 1448
20:34:41.513785 IP 128.30.4.223.5001 > 128.30.4.222.39675: Flags [.], ack 21745, win 331, options [nop,nop,TS val 282202126 ecr 282136482], length 0
20:34:41.513789 IP 128.30.4.222.39675 > 128.30.4.223.5001: Flags [.], seq 55961:57409, ack 1, win 115, options [nop,nop,TS val 282136513 ecr 282202126], length 1448
20:34:41.513792 IP 128.30.4.222.39675 > 128.30.4.223.5001: Flags [.], seq 57409:58857, ack 1, win 115, options [nop,nop,TS val 282136513 ecr 282202126], length 1448
20:34:41.514112 IP 128.30.4.223.5001 > 128.30.4.222.39675: Flags [.], ack 23193, win 331, options [nop,nop,TS val 282202129 ecr 282136482], length 0
20:34:41.514116 IP 128.30.4.222.39675 > 128.30.4.223.5001: Flags [.], seq 58857:60305, ack 1, win 115, options [nop,nop,TS val 282136514 ecr 282202129], length 1448
20:34:41.514119 IP 128.30.4.222.39675 > 128.30.4.223.5001: Flags [.], seq 60305:61753, ack 1, win 115, options [nop,nop,TS val 282136514 ecr 282202129], length 1448
20:34:41.516519 IP 128.30.4.223.5001 > 128.30.4.222.39675: Flags [.], ack 24641, win 331, options [nop,nop,TS val 282202131 ecr 282136482], length 0
20:34:41.516523 IP 128.30.4.222.39675 > 128.30.4.223.5001: Flags [.], seq 61753:63201, ack 1, win 115, options [nop,nop,TS val 282136516 ecr 282202131], length 1448
20:34:41.516526 IP 128.30.4.222.39675 > 128.30.4.223.5001: Flags [.], seq 63201:64649, ack 1, win 115, options [nop,nop,TS val 282136516 ecr 282202131], length 1448
20:34:41.518907 IP 128.30.4.223.5001 > 128.30.4.222.39675: Flags [.], ack 26089, win 331, options [nop,nop,TS val 282202134 ecr 282136487], length 0
20:34:41.518912 IP 128.30.4.222.39675 > 128.30.4.223.5001: Flags [.], seq 64649:66097, ack 1, win 115, options [nop,nop,TS val 282136518 ecr 282202134], length 1448
20:34:41.518915 IP 128.30.4.222.39675 > 128.30.4.223.5001: Flags [.], seq 66097:67545, ack 1, win 115, options [nop,nop,TS val 282136518 ecr 282202134], length 1448
20:34:41.521350 IP 128.30.4.223.5001 > 128.30.4.222.39675: Flags [.], ack 27537, win 331, options [nop,nop,TS val 282202136 ecr 282136487], length 0
20:34:41.521354 IP 128.30.4.222.39675 > 128.30.4.223.5001: Flags [.], seq 67545:68993, ack 1, win 115, options [nop,nop,TS val 282136521 ecr 282202136], length 1448
20:34:41.523746 IP 128.30.4.223.5001 > 128.30.4.222.39675: Flags [.], ack 28985, win 331, options [nop,nop,TS val 282202138 ecr 282136487], length 0
20:34:41.523750 IP 128.30.4.222.39675 > 128.30.4.223.5001: Flags [.], seq 68993:70441, ack 1, win 115, options [nop,nop,TS val 282136523 ecr 282202138], length 1448
20:34:41.526197 IP 128.30.4.223.5001 > 128.30.4.222.39675: Flags [.], ack 30433, win 331, options [nop,nop,TS val 282202141 ecr 282136487], length 0
20:34:41.526200 IP 128.30.4.222.39675 > 128.30.4.223.5001: Flags [.], seq 70441:71889, ack 1, win 115, options [nop,nop,TS val 282136526 ecr 282202141], length 1448
20:34:41.528576 IP 128.30.4.223.5001 > 128.30.4.222.39675: Flags [.], ack 31881, win 331, options [nop,nop,TS val 282202143 ecr 282136489], length 0
20:34:41.528581 IP 128.30.4.222.39675 > 128.30.4.223.5001: Flags [.], seq 71889:73337, ack 1, win 115, options [nop,nop,TS val 282136528 ecr 282202143], length 1448
20:34:41.530732 IP 128.30.4.223.5001 > 128.30.4.222.39675: Flags [.], ack 32793, win 331, options [nop,nop,TS val 282202145 ecr 282136489], length 0
20:34:41.530736 IP 128.30.4.222.39675 > 128.30.4.223.5001: Flags [.], seq 73337:74785, ack 1, win 115, options [nop,nop,TS val 282136530 ecr 282202145], length 1448
20:34:41.535542 IP 128.30.4.223.5001 > 128.30.4.222.39675: Flags [.], ack 35689, win 331, options [nop,nop,TS val 282202150 ecr 282136492], length 0
20:34:41.535549 IP 128.30.4.222.39675 > 128.30.4.223.5001: Flags [.], seq 74785:76233, ack 1, win 115, options [nop,nop,TS val 282136535 ecr 282202150], length 1448
20:34:41.535562 IP 128.30.4.222.39675 > 128.30.4.223.5001: Flags [.], seq 76233:77681, ack 1, win 115, options [nop,nop,TS val 282136535 ecr 282202150], length 1448
20:34:41.542289 IP 128.30.4.223.5001 > 128.30.4.222.39675: Flags [.], ack 38585, win 331, options [nop,nop,TS val 282202155 ecr 282136496], length 0
20:34:41.542308 IP 128.30.4.222.39675 > 128.30.4.223.5001: Flags [.], seq 77681:79129, ack 1, win 115, options [nop,nop,TS val 282136542 ecr 282202155], length 1448
20:34:41.542322 IP 128.30.4.222.39675 > 128.30.4.223.5001: Flags [.], seq 79129:80577, ack 1, win 115, options [nop,nop,TS val 282136542 ecr 282202155], length 1448
20:34:41.544664 IP 128.30.4.223.5001 > 128.30.4.222.39675: Flags [.], ack 41481, win 331, options [nop,nop,TS val 282202159 ecr 282136496], length 0
20:34:41.544676 IP 128.30.4.222.39675 > 128.30.4.223.5001: Flags [.], seq 80577:82025, ack 1, win 115, options [nop,nop,TS val 282136544 ecr 282202159], length 1448
20:34:41.544682 IP 128.30.4.222.39675 > 128.30.4.223.5001: Flags [.], seq 82025:83473, ack 1, win 115, options [nop,nop,TS val 282136544 ecr 282202159], length 1448
20:34:41.555633 IP 128.30.4.223.5001 > 128.30.4.222.39675: Flags [.], ack 44377, win 331, options [nop,nop,TS val 282202168 ecr 282136499,nop,nop,sack 1 {45825:47273}], length 0
20:34:41.555656 IP 128.30.4.222.39675 > 128.30.4.223.5001: Flags [.], seq 83473:84921, ack 1, win 115, options [nop,nop,TS val 282136555 ecr 282202168], length 1448
20:34:41.555671 IP 128.30.4.222.39675 > 128.30.4.223.5001: Flags [.], seq 84921:86369, ack 1, win 115, options [nop,nop,TS val 282136555 ecr 282202168], length 1448
20:34:41.558031 IP 128.30.4.223.5001 > 128.30.4.222.39675: Flags [.], ack 44377, win 331, options [nop,nop,TS val 282202170 ecr 282136499,nop,nop,sack 1 {45825:48721}], length 0
20:34:41.560417 IP 128.30.4.223.5001 > 128.30.4.222.39675: Flags [.], ack 44377, win 331, options [nop,nop,TS val 282202173 ecr 282136499,nop,nop,sack 1 {45825:50169}], length 0
20:34:41.560434 IP 128.30.4.222.39675 > 128.30.4.223.5001: Flags [.], seq 44377:45825, ack 1, win 115, options [nop,nop,TS val 282136560 ecr 282202173], length 1448
20:34:41.562849 IP 128.30.4.223.5001 > 128.30.4.222.39675: Flags [.], ack 44377, win 331, options [nop,nop,TS val 282202175 ecr 282136499,nop,nop,sack 1 {45825:51617}], length 0
20:34:41.563171 IP 128.30.4.223.5001 > 128.30.4.222.39675: Flags [.], ack 44377, win 331, options [nop,nop,TS val 282202177 ecr 282136499,nop,nop,sack 1 {45825:53065}], length 0
20:34:41.569742 IP 128.30.4.223.5001 > 128.30.4.222.39675: Flags [.], ack 44377, win 331, options [nop,nop,TS val 282202180 ecr 282136499,nop,nop,sack 1 {45825:54513}], length 0
20:34:41.572164 IP 128.30.4.223.5001 > 128.30.4.222.39675: Flags [.], ack 44377, win 331, options [nop,nop,TS val 282202182 ecr 282136499,nop,nop,sack 1 {45825:55961}], length 0
20:34:41.572500 IP 128.30.4.223.5001 > 128.30.4.222.39675: Flags [.], ack 44377, win 331, options [nop,nop,TS val 282202184 ecr 282136499,nop,nop,sack 1 {45825:57409}], length 0
20:34:41.574900 IP 128.30.4.223.5001 > 128.30.4.222.39675: Flags [.], ack 44377, win 331, options [nop,nop,TS val 282202187 ecr 282136499,nop,nop,sack 1 {45825:58857}], length 0
20:34:41.575165 IP 128.30.4.223.5001 > 128.30.4.222.39675: Flags [.], ack 44377, win 331, options [nop,nop,TS val 282202190 ecr 282136499,nop,nop,sack 1 {45825:60305}], length 0
20:34:41.577753 IP 128.30.4.223.5001 > 128.30.4.222.39675: Flags [.], ack 44377, win 331, options [nop,nop,TS val 282202192 ecr 282136499,nop,nop,sack 1 {45825:61753}], length 0
20:34:41.580324 IP 128.30.4.223.5001 > 128.30.4.222.39675: Flags [.], ack 44377, win 331, options [nop,nop,TS val 282202195 ecr 282136499,nop,nop,sack 1 {45825:63201}], length 0
20:34:41.582637 IP 128.30.4.223.5001 > 128.30.4.222.39675: Flags [.], ack 44377, win 331, options [nop,nop,TS val 282202197 ecr 282136499,nop,nop,sack 1 {45825:64649}], length 0
20:34:41.589197 IP 128.30.4.223.5001 > 128.30.4.222.39675: Flags [.], ack 44377, win 331, options [nop,nop,TS val 282202200 ecr 282136499,nop,nop,sack 1 {45825:66097}], length 0
20:34:41.589506 IP 128.30.4.223.5001 > 128.30.4.222.39675: Flags [.], ack 44377, win 331, options [nop,nop,TS val 282202202 ecr 282136499,nop,nop,sack 1 {45825:67545}], length 0
20:34:41.589896 IP 128.30.4.223.5001 > 128.30.4.222.39675: Flags [.], ack 44377, win 331, options [nop,nop,TS val 282202204 ecr 282136499,nop,nop,sack 1 {45825:68993}], length 0
20:34:41.592315 IP 128.30.4.223.5001 > 128.30.4.222.39675: Flags [.], ack 44377, win 331, options [nop,nop,TS val 282202207 ecr 282136499,nop,nop,sack 1 {45825:70441}], length 0
20:34:41.594674 IP 128.30.4.223.5001 > 128.30.4.222.39675: Flags [.], ack 44377, win 331, options [nop,nop,TS val 282202209 ecr 282136499,nop,nop,sack 1 {45825:71889}], length 0
20:34:41.597065 IP 128.30.4.223.5001 > 128.30.4.222.39675: Flags [.], ack 44377, win 331, options [nop,nop,TS val 282202212 ecr 282136499,nop,nop,sack 1 {45825:73337}], length 0
20:34:41.599450 IP 128.30.4.223.5001 > 128.30.4.222.39675: Flags [.], ack 44377, win 331, options [nop,nop,TS val 282202214 ecr 282136499,nop,nop,sack 1 {45825:74785}], length 0
20:34:41.601969 IP 128.30.4.223.5001 > 128.30.4.222.39675: Flags [.], ack 44377, win 331, options [nop,nop,TS val 282202217 ecr 282136499,nop,nop,sack 1 {45825:76233}], length 0
20:34:41.604398 IP 128.30.4.223.5001 > 128.30.4.222.39675: Flags [.], ack 44377, win 331, options [nop,nop,TS val 282202219 ecr 282136499,nop,nop,sack 1 {45825:77681}], length 0
20:34:41.608926 IP 128.30.4.223.5001 > 128.30.4.222.39675: Flags [.], ack 44377, win 331, options [nop,nop,TS val 282202222 ecr 282136499,nop,nop,sack 1 {45825:79129}], length 0
20:34:41.609233 IP 128.30.4.223.5001 > 128.30.4.222.39675: Flags [.], ack 44377, win 331, options [nop,nop,TS val 282202224 ecr 282136499,nop,nop,sack 1 {45825:80577}], length 0
20:34:41.611763 IP 128.30.4.223.5001 > 128.30.4.222.39675: Flags [.], ack 44377, win 331, options [nop,nop,TS val 282202226 ecr 282136499,nop,nop,sack 1 {45825:82025}], length 0
20:34:41.614139 IP 128.30.4.223.5001 > 128.30.4.222.39675: Flags [.], ack 44377, win 331, options [nop,nop,TS val 282202229 ecr 282136499,nop,nop,sack 1 {45825:83473}], length 0
20:34:41.616584 IP 128.30.4.223.5001 > 128.30.4.222.39675: Flags [.], ack 44377, win 331, options [nop,nop,TS val 282202231 ecr 282136499,nop,nop,sack 1 {45825:84921}], length 0
20:34:41.619116 IP 128.30.4.223.5001 > 128.30.4.222.39675: Flags [.], ack 44377, win 331, options [nop,nop,TS val 282202234 ecr 282136499,nop,nop,sack 1 {45825:86369}], length 0
20:34:41.621503 IP 128.30.4.223.5001 > 128.30.4.222.39675: Flags [.], ack 86369, win 19, options [nop,nop,TS val 282202236 ecr 282136560], length 0
20:34:41.621527 IP 128.30.4.222.39675 > 128.30.4.223.5001: Flags [P.], seq 86369:87817, ack 1, win 115, options [nop,nop,TS val 282136621 ecr 282202236], length 1448
20:34:41.621804 IP 128.30.4.223.5001 > 128.30.4.222.39675: Flags [.], ack 86369, win 52, options [nop,nop,TS val 282202236 ecr 282136560], length 0
20:34:41.621814 IP 128.30.4.222.39675 > 128.30.4.223.5001: Flags [.], seq 87817:89265, ack 1, win 115, options [nop,nop,TS val 282136621 ecr 282202236], length 1448
20:34:41.621824 IP 128.30.4.222.39675 > 128.30.4.223.5001: Flags [.], seq 89265:90713, ack 1, win 115, options [nop,nop,TS val 282136621 ecr 282202236], length 1448
20:34:41.621831 IP 128.30.4.222.39675 > 128.30.4.223.5001: Flags [.], seq 90713:92161, ack 1, win 115, options [nop,nop,TS val 282136621 ecr 282202236], length 1448
20:34:41.624127 IP 128.30.4.223.5001 > 128.30.4.222.39675: Flags [.], ack 86369, win 119, options [nop,nop,TS val 282202236 ecr 282136560], length 0
20:34:41.624137 IP 128.30.4.222.39675 > 128.30.4.223.5001: Flags [.], seq 92161:93609, ack 1, win 115, options [nop,nop,TS val 282136624 ecr 282202236], length 1448
20:34:41.624147 IP 128.30.4.222.39675 > 128.30.4.223.5001: Flags [.], seq 93609:95057, ack 1, win 115, options [nop,nop,TS val 282136624 ecr 282202236], length 1448
20:34:41.624152 IP 128.30.4.222.39675 > 128.30.4.223.5001: Flags [.], seq 95057:96505, ack 1, win 115, options [nop,nop,TS val 282136624 ecr 282202236], length 1448
20:34:41.624156 IP 128.30.4.222.39675 > 128.30.4.223.5001: Flags [.], seq 96505:97953, ack 1, win 115, options [nop,nop,TS val 282136624 ecr 282202236], length 1448
20:34:41.624160 IP 128.30.4.222.39675 > 128.30.4.223.5001: Flags [.], seq 97953:99401, ack 1, win 115, options [nop,nop,TS val 282136624 ecr 282202236], length 1448
20:34:41.624165 IP 128.30.4.222.39675 > 128.30.4.223.5001: Flags [.], seq 99401:100849, ack 1, win 115, options [nop,nop,TS val 282136624 ecr 282202236], length 1448
20:34:41.624398 IP 128.30.4.223.5001 > 128.30.4.222.39675: Flags [.], ack 86369, win 331, options [nop,nop,TS val 282202236 ecr 282136560], length 0
20:34:41.624414 IP 128.30.4.222.39675 > 128.30.4.223.5001: Flags [.], seq 100849:102297, ack 1, win 115, options [nop,nop,TS val 282136624 ecr 282202236], length 1448
20:34:41.624429 IP 128.30.4.222.39675 > 128.30.4.223.5001: Flags [.], seq 102297:103745, ack 1, win 115, options [nop,nop,TS val 282136624 ecr 282202236], length 1448
20:34:41.624436 IP 128.30.4.222.39675 > 128.30.4.223.5001: Flags [.], seq 103745:105193, ack 1, win 115, options [nop,nop,TS val 282136624 ecr 282202236], length 1448
20:34:41.624442 IP 128.30.4.222.39675 > 128.30.4.223.5001: Flags [.], seq 105193:106641, ack 1, win 115, options [nop,nop,TS val 282136624 ecr 282202236], length 1448
20:34:41.624448 IP 128.30.4.222.39675 > 128.30.4.223.5001: Flags [.], seq 106641:108089, ack 1, win 115, options [nop,nop,TS val 282136624 ecr 282202236], length 1448
20:34:41.624453 IP 128.30.4.222.39675 > 128.30.4.223.5001: Flags [.], seq 108089:109537, ack 1, win 115, options [nop,nop,TS val 282136624 ecr 282202236], length 1448
20:34:41.624458 IP 128.30.4.222.39675 > 128.30.4.223.5001: Flags [.], seq 109537:110985, ack 1, win 115, options [nop,nop,TS val 282136624 ecr 282202236], length 1448
20:34:41.624462 IP 128.30.4.222.39675 > 128.30.4.223.5001: Flags [.], seq 110985:112433, ack 1, win 115, options [nop,nop,TS val 282136624 ecr 282202236], length 1448
20:34:41.624466 IP 128.30.4.222.39675 > 128.30.4.223.5001: Flags [.], seq 112433:113881, ack 1, win 115, options [nop,nop,TS val 282136624 ecr 282202236], length 1448
20:34:41.624471 IP 128.30.4.222.39675 > 128.30.4.223.5001: Flags [.], seq 113881:115329, ack 1, win 115, options [nop,nop,TS val 282136624 ecr 282202236], length 1448
20:34:41.626770 IP 128.30.4.223.5001 > 128.30.4.222.39675: Flags [.], ack 89265, win 331, options [nop,nop,TS val 282202241 ecr 282136621], length 0
20:34:41.626775 IP 128.30.4.222.39675 > 128.30.4.223.5001: Flags [P.], seq 115329:116777, ack 1, win 115, options [nop,nop,TS val 282136626 ecr 282202241], length 1448
20:34:41.626778 IP 128.30.4.222.39675 > 128.30.4.223.5001: Flags [.], seq 116777:118225, ack 1, win 115, options [nop,nop,TS val 282136626 ecr 282202241], length 1448
20:34:41.626780 IP 128.30.4.222.39675 > 128.30.4.223.5001: Flags [.], seq 118225:119673, ack 1, win 115, options [nop,nop,TS val 282136626 ecr 282202241], length 1448
20:34:41.631696 IP 128.30.4.223.5001 > 128.30.4.222.39675: Flags [.], ack 92161, win 331, options [nop,nop,TS val 282202246 ecr 282136621], length 0
20:34:41.631711 IP 128.30.4.222.39675 > 128.30.4.223.5001: Flags [.], seq 119673:121121, ack 1, win 115, options [nop,nop,TS val 282136631 ecr 282202246], length 1448
20:34:41.631724 IP 128.30.4.222.39675 > 128.30.4.223.5001: Flags [.], seq 121121:122569, ack 1, win 115, options [nop,nop,TS val 282136631 ecr 282202246], length 1448
20:34:41.636386 IP 128.30.4.223.5001 > 128.30.4.222.39675: Flags [.], ack 95057, win 331, options [nop,nop,TS val 282202251 ecr 282136624], length 0
20:34:41.636404 IP 128.30.4.222.39675 > 128.30.4.223.5001: Flags [.], seq 122569:124017, ack 1, win 115, options [nop,nop,TS val 282136636 ecr 282202251], length 1448
20:34:41.636418 IP 128.30.4.222.39675 > 128.30.4.223.5001: Flags [.], seq 124017:125465, ack 1, win 115, options [nop,nop,TS val 282136636 ecr 282202251], length 1448
20:34:41.640721 IP 128.30.4.223.5001 > 128.30.4.222.39675: Flags [.], ack 97953, win 331, options [nop,nop,TS val 282202255 ecr 282136624], length 0
20:34:41.640739 IP 128.30.4.222.39675 > 128.30.4.223.5001: Flags [.], seq 125465:126913, ack 1, win 115, options [nop,nop,TS val 282136640 ecr 282202255], length 1448
20:34:41.640753 IP 128.30.4.222.39675 > 128.30.4.223.5001: Flags [.], seq 126913:128361, ack 1, win 115, options [nop,nop,TS val 282136640 ecr 282202255], length 1448
20:34:41.647418 IP 128.30.4.223.5001 > 128.30.4.222.39675: Flags [.], ack 100849, win 331, options [nop,nop,TS val 282202260 ecr 282136624], length 0
20:34:41.647431 IP 128.30.4.222.39675 > 128.30.4.223.5001: Flags [.], seq 128361:129809, ack 1, win 115, options [nop,nop,TS val 282136647 ecr 282202260], length 1448
20:34:41.647440 IP 128.30.4.222.39675 > 128.30.4.223.5001: Flags [.], seq 129809:131257, ack 1, win 115, options [nop,nop,TS val 282136647 ecr 282202260], length 1448
20:34:41.649770 IP 128.30.4.223.5001 > 128.30.4.222.39675: Flags [.], ack 103745, win 353, options [nop,nop,TS val 282202265 ecr 282136624], length 0
20:34:41.649784 IP 128.30.4.222.39675 > 128.30.4.223.5001: Flags [.], seq 131257:132705, ack 1, win 115, options [nop,nop,TS val 282136649 ecr 282202265], length 1448
20:34:41.649792 IP 128.30.4.222.39675 > 128.30.4.223.5001: Flags [.], seq 132705:134153, ack 1, win 115, options [nop,nop,TS val 282136649 ecr 282202265], length 1448
20:34:41.658728 IP 128.30.4.223.5001 > 128.30.4.222.39675: Flags [.], ack 105193, win 376, options [nop,nop,TS val 282202271 ecr 282136624,nop,nop,sack 1 {106641:108089}], length 0
20:34:41.658748 IP 128.30.4.222.39675 > 128.30.4.223.5001: Flags [.], seq 134153:135601, ack 1, win 115, options [nop,nop,TS val 282136658 ecr 282202271], length 1448
20:34:41.658761 IP 128.30.4.222.39675 > 128.30.4.223.5001: Flags [.], seq 135601:137049, ack 1, win 115, options [nop,nop,TS val 282136658 ecr 282202271], length 1448
20:34:41.659108 IP 128.30.4.223.5001 > 128.30.4.222.39675: Flags [.], ack 105193, win 376, options [nop,nop,TS val 282202273 ecr 282136624,nop,nop,sack 1 {106641:109537}], length 0
20:34:41.659120 IP 128.30.4.222.39675 > 128.30.4.223.5001: Flags [.], seq 137049:138497, ack 1, win 115, options [nop,nop,TS val 282136659 ecr 282202273], length 1448
20:34:41.661516 IP 128.30.4.223.5001 > 128.30.4.222.39675: Flags [.], ack 105193, win 376, options [nop,nop,TS val 282202276 ecr 282136624,nop,nop,sack 1 {106641:110985}], length 0
20:34:41.661529 IP 128.30.4.222.39675 > 128.30.4.223.5001: Flags [.], seq 105193:106641, ack 1, win 115, options [nop,nop,TS val 282136661 ecr 282202276], length 1448
20:34:41.664042 IP 128.30.4.223.5001 > 128.30.4.222.39675: Flags [.], ack 105193, win 376, options [nop,nop,TS val 282202279 ecr 282136624,nop,nop,sack 1 {106641:112433}], length 0
20:34:41.664054 IP 128.30.4.222.39675 > 128.30.4.223.5001: Flags [.], seq 138497:139945, ack 1, win 115, options [nop,nop,TS val 282136664 ecr 282202279], length 1448
20:34:41.666445 IP 128.30.4.223.5001 > 128.30.4.222.39675: Flags [.], ack 105193, win 376, options [nop,nop,TS val 282202281 ecr 282136624,nop,nop,sack 1 {106641:113881}], length 0
20:34:41.668947 IP 128.30.4.223.5001 > 128.30.4.222.39675: Flags [.], ack 105193, win 376, options [nop,nop,TS val 282202284 ecr 282136624,nop,nop,sack 1 {106641:115329}], length 0
20:34:41.668958 IP 128.30.4.222.39675 > 128.30.4.223.5001: Flags [.], seq 139945:141393, ack 1, win 115, options [nop,nop,TS val 282136668 ecr 282202284], length 1448
20:34:41.671566 IP 128.30.4.223.5001 > 128.30.4.222.39675: Flags [.], ack 105193, win 376, options [nop,nop,TS val 282202286 ecr 282136624,nop,nop,sack 1 {106641:116777}], length 0
20:34:41.671586 IP 128.30.4.222.39675 > 128.30.4.223.5001: Flags [.], seq 141393:142841, ack 1, win 115, options [nop,nop,TS val 282136671 ecr 282202286], length 1448
20:34:41.673993 IP 128.30.4.223.5001 > 128.30.4.222.39675: Flags [.], ack 105193, win 376, options [nop,nop,TS val 282202289 ecr 282136624,nop,nop,sack 1 {106641:118225}], length 0
20:34:41.678537 IP 128.30.4.223.5001 > 128.30.4.222.39675: Flags [.], ack 105193, win 376, options [nop,nop,TS val 282202291 ecr 282136624,nop,nop,sack 1 {106641:119673}], length 0
20:34:41.678555 IP 128.30.4.222.39675 > 128.30.4.223.5001: Flags [.], seq 142841:144289, ack 1, win 115, options [nop,nop,TS val 282136678 ecr 282202291], length 1448
20:34:41.678809 IP 128.30.4.223.5001 > 128.30.4.222.39675: Flags [.], ack 105193, win 376, options [nop,nop,TS val 282202293 ecr 282136624,nop,nop,sack 1 {106641:121121}], length 0
20:34:41.678822 IP 128.30.4.222.39675 > 128.30.4.223.5001: Flags [.], seq 144289:145737, ack 1, win 115, options [nop,nop,TS val 282136678 ecr 282202293], length 1448
20:34:41.683249 IP 128.30.4.223.5001 > 128.30.4.222.39675: Flags [.], ack 105193, win 376, options [nop,nop,TS val 282202296 ecr 282136624,nop,nop,sack 1 {106641:122569}], length 0
20:34:41.683553 IP 128.30.4.223.5001 > 128.30.4.222.39675: Flags [.], ack 105193, win 376, options [nop,nop,TS val 282202298 ecr 282136624,nop,nop,sack 1 {106641:124017}], length 0
20:34:41.683565 IP 128.30.4.222.39675 > 128.30.4.223.5001: Flags [.], seq 145737:147185, ack 1, win 115, options [nop,nop,TS val 282136683 ecr 282202298], length 1448
20:34:41.685941 IP 128.30.4.223.5001 > 128.30.4.222.39675: Flags [.], ack 105193, win 376, options [nop,nop,TS val 282202301 ecr 282136624,nop,nop,sack 1 {106641:125465}], length 0
20:34:41.685953 IP 128.30.4.222.39675 > 128.30.4.223.5001: Flags [.], seq 147185:148633, ack 1, win 115, options [nop,nop,TS val 282136685 ecr 282202301], length 1448
20:34:41.688388 IP 128.30.4.223.5001 > 128.30.4.222.39675: Flags [.], ack 105193, win 376, options [nop,nop,TS val 282202303 ecr 282136624,nop,nop,sack 1 {106641:126913}], length 0
20:34:41.690718 IP 128.30.4.223.5001 > 128.30.4.222.39675: Flags [.], ack 105193, win 376, options [nop,nop,TS val 282202305 ecr 282136624,nop,nop,sack 1 {106641:128361}], length 0
20:34:41.690737 IP 128.30.4.222.39675 > 128.30.4.223.5001: Flags [.], seq 148633:150081, ack 1, win 115, options [nop,nop,TS val 282136690 ecr 282202305], length 1448
20:34:41.693133 IP 128.30.4.223.5001 > 128.30.4.222.39675: Flags [.], ack 105193, win 376, options [nop,nop,TS val 282202308 ecr 282136624,nop,nop,sack 1 {106641:129809}], length 0
20:34:41.693151 IP 128.30.4.222.39675 > 128.30.4.223.5001: Flags [.], seq 150081:151529, ack 1, win 115, options [nop,nop,TS val 282136693 ecr 282202308], length 1448
20:34:41.695730 IP 128.30.4.223.5001 > 128.30.4.222.39675: Flags [.], ack 105193, win 376, options [nop,nop,TS val 282202310 ecr 282136624,nop,nop,sack 1 {106641:131257}], length 0
20:34:41.700420 IP 128.30.4.223.5001 > 128.30.4.222.39675: Flags [.], ack 105193, win 376, options [nop,nop,TS val 282202313 ecr 282136624,nop,nop,sack 1 {106641:132705}], length 0
20:34:41.700717 IP 128.30.4.223.5001 > 128.30.4.222.39675: Flags [.], ack 105193, win 376, options [nop,nop,TS val 282202315 ecr 282136624,nop,nop,sack 1 {106641:134153}], length 0
20:34:41.700722 IP 128.30.4.222.39675 > 128.30.4.223.5001: Flags [.], seq 151529:152977, ack 1, win 115, options [nop,nop,TS val 282136700 ecr 282202315], length 1448
20:34:41.705285 IP 128.30.4.223.5001 > 128.30.4.222.39675: Flags [.], ack 105193, win 376, options [nop,nop,TS val 282202318 ecr 282136624,nop,nop,sack 1 {106641:135601}], length 0
20:34:41.707691 IP 128.30.4.223.5001 > 128.30.4.222.39675: Flags [.], ack 105193, win 376, options [nop,nop,TS val 282202320 ecr 282136624,nop,nop,sack 1 {106641:137049}], length 0
20:34:41.710009 IP 128.30.4.223.5001 > 128.30.4.222.39675: Flags [.], ack 105193, win 376, options [nop,nop,TS val 282202322 ecr 282136624,nop,nop,sack 1 {106641:138497}], length 0
20:34:41.710292 IP 128.30.4.223.5001 > 128.30.4.222.39675: Flags [.], ack 138497, win 213, options [nop,nop,TS val 282202325 ecr 282136661], length 0
20:34:41.710313 IP 128.30.4.222.39675 > 128.30.4.223.5001: Flags [.], seq 152977:154425, ack 1, win 115, options [nop,nop,TS val 282136710 ecr 282202325], length 1448
20:34:41.710327 IP 128.30.4.222.39675 > 128.30.4.223.5001: Flags [.], seq 154425:155873, ack 1, win 115, options [nop,nop,TS val 282136710 ecr 282202325], length 1448
20:34:41.710333 IP 128.30.4.222.39675 > 128.30.4.223.5001: Flags [.], seq 155873:157321, ack 1, win 115, options [nop,nop,TS val 282136710 ecr 282202325], length 1448
20:34:41.710341 IP 128.30.4.222.39675 > 128.30.4.223.5001: Flags [.], seq 157321:158769, ack 1, win 115, options [nop,nop,TS val 282136710 ecr 282202325], length 1448
20:34:41.712656 IP 128.30.4.223.5001 > 128.30.4.222.39675: Flags [.], ack 139945, win 398, options [nop,nop,TS val 282202327 ecr 282136664], length 0
20:34:41.712668 IP 128.30.4.222.39675 > 128.30.4.223.5001: Flags [.], seq 158769:160217, ack 1, win 115, options [nop,nop,TS val 282136712 ecr 282202327], length 1448
20:34:41.712676 IP 128.30.4.222.39675 > 128.30.4.223.5001: Flags [.], seq 160217:161665, ack 1, win 115, options [nop,nop,TS val 282136712 ecr 282202327], length 1448
20:34:41.715032 IP 128.30.4.223.5001 > 128.30.4.222.39675: Flags [.], ack 141393, win 421, options [nop,nop,TS val 282202330 ecr 282136668], length 0
20:34:41.715043 IP 128.30.4.222.39675 > 128.30.4.223.5001: Flags [.], seq 161665:163113, ack 1, win 115, options [nop,nop,TS val 282136715 ecr 282202330], length 1448
20:34:41.719612 IP 128.30.4.223.5001 > 128.30.4.222.39675: Flags [.], ack 142841, win 444, options [nop,nop,TS val 282202332 ecr 282136671], length 0
20:34:41.719631 IP 128.30.4.222.39675 > 128.30.4.223.5001: Flags [.], seq 163113:164561, ack 1, win 115, options [nop,nop,TS val 282136719 ecr 282202332], length 1448
20:34:41.721981 IP 128.30.4.223.5001 > 128.30.4.222.39675: Flags [.], ack 144289, win 466, options [nop,nop,TS val 282202334 ecr 282136678], length 0
20:34:41.721993 IP 128.30.4.222.39675 > 128.30.4.223.5001: Flags [.], seq 164561:166009, ack 1, win 115, options [nop,nop,TS val 282136721 ecr 282202334], length 1448
20:34:41.724334 IP 128.30.4.223.5001 > 128.30.4.222.39675: Flags [.], ack 145737, win 489, options [nop,nop,TS val 282202337 ecr 282136678], length 0
20:34:41.724350 IP 128.30.4.222.39675 > 128.30.4.223.5001: Flags [P.], seq 166009:167457, ack 1, win 115, options [nop,nop,TS val 282136724 ecr 282202337], length 1448
20:34:41.724610 IP 128.30.4.223.5001 > 128.30.4.222.39675: Flags [.], ack 147185, win 512, options [nop,nop,TS val 282202339 ecr 282136683], length 0
20:34:41.724629 IP 128.30.4.222.39675 > 128.30.4.223.5001: Flags [.], seq 167457:168905, ack 1, win 115, options [nop,nop,TS val 282136724 ecr 282202339], length 1448
20:34:41.729057 IP 128.30.4.223.5001 > 128.30.4.222.39675: Flags [.], ack 148633, win 534, options [nop,nop,TS val 282202342 ecr 282136685], length 0
20:34:41.729070 IP 128.30.4.222.39675 > 128.30.4.223.5001: Flags [.], seq 168905:170353, ack 1, win 115, options [nop,nop,TS val 282136729 ecr 282202342], length 1448
20:34:41.731442 IP 128.30.4.223.5001 > 128.30.4.222.39675: Flags [.], ack 150081, win 557, options [nop,nop,TS val 282202344 ecr 282136690], length 0
20:34:41.731453 IP 128.30.4.222.39675 > 128.30.4.223.5001: Flags [.], seq 170353:171801, ack 1, win 115, options [nop,nop,TS val 282136731 ecr 282202344], length 1448
20:34:41.734276 IP 128.30.4.223.5001 > 128.30.4.222.39675: Flags [.], ack 151529, win 579, options [nop,nop,TS val 282202346 ecr 282136693], length 0
20:34:41.734288 IP 128.30.4.222.39675 > 128.30.4.223.5001: Flags [.], seq 171801:173249, ack 1, win 115, options [nop,nop,TS val 282136734 ecr 282202346], length 1448
20:34:41.734298 IP 128.30.4.222.39675 > 128.30.4.223.5001: Flags [.], seq 173249:174697, ack 1, win 115, options [nop,nop,TS val 282136734 ecr 282202346], length 1448
20:34:41.736668 IP 128.30.4.223.5001 > 128.30.4.222.39675: Flags [.], ack 152977, win 602, options [nop,nop,TS val 282202349 ecr 282136700], length 0
20:34:41.736679 IP 128.30.4.222.39675 > 128.30.4.223.5001: Flags [.], seq 174697:176145, ack 1, win 115, options [nop,nop,TS val 282136736 ecr 282202349], length 1448
20:34:41.736910 IP 128.30.4.223.5001 > 128.30.4.222.39675: Flags [.], ack 154425, win 625, options [nop,nop,TS val 282202351 ecr 282136710], length 0
20:34:41.736918 IP 128.30.4.222.39675 > 128.30.4.223.5001: Flags [.], seq 176145:177593, ack 1, win 115, options [nop,nop,TS val 282136736 ecr 282202351], length 1448
20:34:41.739444 IP 128.30.4.223.5001 > 128.30.4.222.39675: Flags [.], ack 155873, win 647, options [nop,nop,TS val 282202354 ecr 282136710], length 0
20:34:41.739462 IP 128.30.4.222.39675 > 128.30.4.223.5001: Flags [.], seq 177593:179041, ack 1, win 115, options [nop,nop,TS val 282136739 ecr 282202354], length 1448
20:34:41.741924 IP 128.30.4.223.5001 > 128.30.4.222.39675: Flags [.], ack 157321, win 670, options [nop,nop,TS val 282202357 ecr 282136710], length 0
20:34:41.741937 IP 128.30.4.222.39675 > 128.30.4.223.5001: Flags [.], seq 179041:180489, ack 1, win 115, options [nop,nop,TS val 282136741 ecr 282202357], length 1448
20:34:41.744327 IP 128.30.4.223.5001 > 128.30.4.222.39675: Flags [.], ack 158769, win 693, options [nop,nop,TS val 282202359 ecr 282136710], length 0
20:34:41.744339 IP 128.30.4.222.39675 > 128.30.4.223.5001: Flags [.], seq 180489:181937, ack 1, win 115, options [nop,nop,TS val 282136744 ecr 282202359], length 1448
20:34:41.746633 IP 128.30.4.223.5001 > 128.30.4.222.39675: Flags [.], ack 160217, win 715, options [nop,nop,TS val 282202361 ecr 282136712], length 0
20:34:41.746644 IP 128.30.4.222.39675 > 128.30.4.223.5001: Flags [.], seq 181937:183385, ack 1, win 115, options [nop,nop,TS val 282136746 ecr 282202361], length 1448
20:34:41.749037 IP 128.30.4.223.5001 > 128.30.4.222.39675: Flags [.], ack 161665, win 738, options [nop,nop,TS val 282202364 ecr 282136712], length 0
20:34:41.749048 IP 128.30.4.222.39675 > 128.30.4.223.5001: Flags [.], seq 183385:184833, ack 1, win 115, options [nop,nop,TS val 282136749 ecr 282202364], length 1448
20:34:41.757717 IP 128.30.4.223.5001 > 128.30.4.222.39675: Flags [.], ack 163113, win 760, options [nop,nop,TS val 282202366 ecr 282136715], length 0
20:34:41.757734 IP 128.30.4.222.39675 > 128.30.4.223.5001: Flags [.], seq 184833:186281, ack 1, win 115, options [nop,nop,TS val 282136757 ecr 282202366], length 1448
20:34:41.764142 IP 128.30.4.223.5001 > 128.30.4.222.39675: Flags [.], ack 166009, win 806, options [nop,nop,TS val 282202370 ecr 282136721], length 0
